cleaned_comment,vaccine_view,about_doctor_mike,format_criticism,misinformation,emotion_personal_experience
me being a medical student myself  was so shocked to see how much misinformation many people have and then telling dr mike how they have read this and that and in reality it was all they would have heard somewhere and  never bothered to fact check it or even know how a disease spreads and they come here and try to question him who had undergone so many years of med school and residency and knows the disease inside out is just appalling because throughout watching the video my expressions were just of shock ,,neutral,yes,,
not impressed with rfk ,,,,,
i think some of these things are valid but that one girl whos a conspiracy theorist made my eyes roll,,,,yes,
so far everyone in this video just got up and proved his point with their arguments  ,,,,,
1347 so far no one has given dr mike chance to even talk nor have any of them even tried to prove against his claim they havent asked what lies dr mike is referring to 2048 a lot of did you know a lot of people that didnt learn things when they were younger all the sudden wanting to learn stuff and think they are in some kind of special in the know underground people 2340 again they switch once dr mike starts talking,,positive,,,
it seems like they all start to vote for a new speaker as soon as hes given a chance to respond,,,yes,,
an hour in and so far it seems like its more 6 out of 20 available antivaxxers against one doctor lol,skeptic,,,,
i wish that they could be fact checked in real time,,,,,
i saw a guy hiking in the mountains alone wearing a mask   that is the fault of our fear wondering greedy medical system making billions out of fearful sheep psychological warfare at its best,,,yes,,
that woman said what do they need protection against in the first couple hours of life like are you aware of what happens in a hospital,,,,,
was she forced or not cause dr mike asked if she was forced and she said no about a minute later she said she was forced to get the vaccine,skeptic,neutral,,,
this guy is should have been the one in facts position not face,,,,,
that lady with the rhead was the most unsigned of the group like wtf was the point of her being there when she fully admitted that what ever drive said wouldnt really change her mind,,,,,
wow its a choice get the vaccine or lose your job mention everything yeah sounds like a choice ,skeptic,,,,
representing nj when this doctor doesnt have an answer he says its a just  a coincidence ,,,,,
im sorry im new here can someone explain the point of having ref flags and why they use them as a vote method,,,yes,,yes
as soon as we are born they give us the hep b shot so how do we know thats not what caused the seizures,,,,,
yes the guy talking about natural healing and the rockefellers  yes,,,,,
yeah they really should pause the conversation and fact check verbally,,,,,
we should have the choice period,,,,,
i love how the guy with the funny jacket got hockey mocked in the closing remarks lol,,,,,
i encourage these people to move to places in the world that weren as fortunate as them to even be able to get fascinated regardless of whether they believed they were effective or not  maybe they should trade places with people who want to live a better and healthier life but are unable to solely because of the place they were born,,,,,
girl with red hair cannot be serious,,,,,
the second girl in blue  why did they boot her so fast ,,,,,
dr mike looking a little chubbier than he used to,,neutral,,,
telling a doctor a study done in a foreign and healthier country isnt true without looking up the research is insane lady in the denim jacket already has her mind set is not openminded and will not accept other data then what she wants to believe,,,,,yes
these debuts dont understand the difference between asking a question and making an impassioned uninformed speech,,,,,
he is basically teaching basic science to these people lol,,,,,
the reason why those people are so off is cause they havent learn to be open to ideas so now when one of them tries to speak the others dont even give them a chance  basically they are getting a taste of their own medicine problem is i still dont think they ll even realize any of this,,,,,
there are medical doctors out there who became antivaxxers discussions between them and doc mike would be interesting and we could truly learn something why not be fair,skeptic,neutral,,,
the first girl set the tone for how low  intelligent this was going to be,,,,,
du kan ikke ænde dumped i diss mennesker,,,,,
all this video has proved to me is what i already thought non vaxxers have low iq,skeptic,,,,
omg the third guy was soooooo fringe he was all over the place trying to quickly get in so many different points when in all reality he just wanted to start a racecolonialism debate treating each other better having clean food having media that doesnt lie we all want that for ourselves and our kids but that has nothing to do with the debate at hand which is should we be giving people vaccines or not how hard is it for some of these people to just think rationally and leave their emotions out of it and stay on topic,skeptic,,yes,,
the first lady sounds like she made up all the i have a friend i have another friend stories she might have been telling the truth but the tone and the way she speaks makes her sound like those kids in school that used to make up stories on the spot,,,,,
the government is never wrong or make mistakes even when they do they dont,,,,,
doctor mike is supporting science and biology and these other people are talking about politics those are 2 different worlds and politics does tend to override science but that does not make the science claims false,,neutral,,,
how many millions of people have died from the measles vaccine in canada the measles virus was eradicated in 1998 i was born 1984 but as an adult i developed egg allergies and because of that flu vaccines have gone off the table,pro-vaccine,,,,
its easier to fool people than to convince them that they have been fooled,,,,,
the wealthiest communities in the world are the least fascinated ones,,,,,
which communitiesmistergadomsky4577,,,,,
mma remember that,,,,,
these people are insufferable,,,,,
ive always just thought that anti papers were just scared of needles,,,,,
bro overtime mike got the chance to respond to a claim everyone raised their hands,,neutral,,,
i get what you are trying to do i appreciate that this needs to be inclusive but trying to argue with someone that doesnt believe 11  2 is very difficult you do not have the same languageframe of defence but working towards removing the division is absolutely pivotal,,,,,
doctor mike is a part of the depopulation cult and he doesnt even know it,,neutral,,,
i have a hard time believing that big pharma cares about our safety more than profits  i was in a car wreck in 2001 and to this day in a drawer in my living room i kept the pamphlet my dr gave me explaining that oxycontin is not addictive,,,,,
dr mike is jewish,,neutral,,,
why not bring 20 doctor anti vaxxer  vs doctor mike,skeptic,neutral,,,
its always i know one person who lol,,,,,
my youngest three children arent fascinated they are completely fine yes because everyone else is,,,,,
props to dr mike for having the nerve to deal with so many selfcentred people at once,,neutral,,,
this is the most vote outs ive seen wtf,,,yes,,
trying to tell a doctor how aids is actually contracted and immediately getting fact checked on screen is an all timer im afraid lmaz,,,,,
i want to see doctor mike in another video with people who arent completely selfcentered cause this passes me off,,neutral,,,
the 1st woman is mental,,,,,
1712,,,,,
this doctor is so damn intelligent and eloquent got a fan,,,,,
i feel like jubilee didnt give doctor mike and the anti papers enough time to talk per person like i feel like a lot of there conversations were cut short,,neutral,,,yes
their feeling arguments hurt my brain,,,,,yes
the red hair lady was drowning in factchecks  most of these ppl are simply nuts,,,,,
if there is a big pharma trying to profit off our illness why would they also be trying to depopulated the world causing a loss in profit,,,,,
i actually read and study  to a doctor is crazzyyyyyyyy bro,,,,,
yes and theyre super loud and force their opinions on others,,,,,
the first mom knows you talk to enough ppl and you put the pieces together,,,,,
they dont even let him address their questions without the group voting to change the debate,,,yes,,
dr mike  paid to support vaccines and big pharma bottom line  timing is interesting in light of the newtoyoutube videos showing from mds the mra technology can cause myocarditis in young males and other groups,skeptic,neutral,,,
im a nurse and i would love to follow this whole debate but i couldnt i can not finish this discussion through this format i applaud dr mike for being to patient most of the arguments from the participants are just not objective enough to take serious,,positive,yes,,
i wish dr mike had the chance to make his point before the person across from him was voted off,,neutral,yes,,
the pediatric nurse got voted way too quickly the discussion actually was quite interesting,,,yes,,
4201 im confused why he said that because he too is not letting her argument influence him although he does try to make it seem like that by saying that he understands but he always comes back to his claims as if he he heard nothing   edit but she is also a little bias,,,,,
dude at 840 was going on a schism rant,,,,,
get rid of the red flags and have only the timer they do nothing but consistently interrupt conversation,,,yes,,
not a single scientific reasoning behind why vaccines are non dangerous and how vaccines actually work wow,pro-vaccine,,,,
how can dr mike with a straight face say that unvaccinated kids would put fascinated kids are risk that statement is so illogical surely it is the unvaccinated kid that is at risk not the kids who have had the vaccine otherwise it kind of just goes against his entire argument that vaccines prevent disease either vaccines work by protecting the fascinated and it then follows that they are at lower risk than unvaccinated kids or the fascinated kids are at more of a risk than the unvaccinated which is it,pro-vaccine,positive,,,
i dont know how dr mike can call the cdc independent review bodies when he probably knows there is a revolving door between the pharma companies and the cdc and when it is the pharma companies that pay the cdc for their independent reviews as well as lobbying government for fewer regulations in essence the pharma companies regulate themselves and review their own drugs to market this is exactly how they have been able to lack transparency and hide data that shows their drugs to be far more harmful than is ever let on just look at how the tackle family were able to manipulate the cdc to label oxycontin as less addictive than other opioids even when they were more than 4 times more addictive this is precisely because of the revolving door between the cdc and big pharma this is exactly what rfk jnr is bringing to an end and it is not before time,,neutral,,,
the entirety of this room is just an echo chamber passive aggressive and just nods to everything being said only one or two of them actually had a meaningful argument and were well spoken its so difficult to have a discourse with people like them and i feel bad for dr mike for sitting there with them trying to provide his professional perspective yet the people are just listening to what they want to hear,,neutral,,,yes
classic survivorship bias if it didnt happen to me then it cant happen classic logical fallacy,,,,,
most of them didnt even debate against dr makes quotes they just started ranting about their own experiences with vaccines if my teacher said anti vaccine lies cost lives they would expect me to argument why they arent lies and why it doesnt cost lives not say well my friend had a stroke after taking a vaccine so i feel threatened of course they have valid reasons to distrust vaccines but they need to keep the topic consistent,skeptic,,yes,,yes
i bet i can guess who they voted for,,,yes,,
so dr mike gives you a real comparison and you leave voodoo come back   also i wonder if theres antivaxxers that are provide bc how,skeptic,neutral,,,
prove it that the  saved over 100 million lives   what a clown this doctor is,,,,,
there is no such thing as a safe    end of story,,,,,
doctor what led to your mistrust    what a clown,,,,,
brush even when it comes to young males the affected demographic were talking about 25 cases at most per million doses and the symptoms are generally mild in comparison the risk of developing myocarditis from the sickness itself would be 26 times higher without the vaccine so even when we highlight this particular effect its a weak argument,skeptic,,,,
what youre seeing is people leading with emotion rather than medicine  i applaud the doctor for being so patient as well,,,,,
stop spamming comments pure mapping,,,,,
job application jumpscare,,,,,
masks dont work thats been proven over and over   face is a virus,,,,,
seatbelt argument was deflection  not even comparable to something you cannot get out of your body once its in,,,,,
i love dr mike for doing this but i hate this video,,neutral,,,
the one who sat down about 19 minutes into this video seems to be the most on target ,,,,,
no way some guy said people arent talking about getting the fluoride out of the water when there wasnt fluoride so many people had terrible teeth and it actually helps to have fluoride,,,,,
i worked in a funeral home during the pandemic and didnt take the vaccine and i know people that took it and the families told us that their loved one was just fine until they took the vaccine so ill take my chances ,pro-vaccine,,,,
this doctor isnt the reason all hate your lives guys why so rude,,,,,
parents who dont want to vaccine have to take their children home and be quarantined when theres an outbreak for some states not all  that should be the case for all states im all for children not having the shots but the sickness shouldnt spread because of that,skeptic,,,,
i actually read and study  that has the same feeling of telling gordon ramsay you can cook a delicious frozen burger on your stove,,,,,yes
why would they vote out all the interesting conversations,,,yes,,
is it illegal to think in the usa,,,,,
we should start making conspiracy theories that are actually just the truth and maybe people will catch on,,,,yes,
i fully believe in full consent vaccines can cause problems including death so the decision to vaccine or not vaccine is not a decision to be made lightly   my friend lost her baby to the mm it was horrific  they labeled the death side even though her baby never made it home from the doctor appointment,anti-vaccine,,,,yes
heres a doctor i would never see ,,,,,
this channels fact checkers are wrong most of the time,,,,,
strawman,,,,,
13016 i am afraid for this woman baby,,,,,
one way we could do that is connecting more with nature where are you finding these idiots oh yeah america,,,,,
follow the money always has nobody ever seen the fugitive,,,,,
likes we have to share the planet with these idiots  ff,,,,,
proof give an example,,,,,
they literally are not you psychopath,,,,,
i love the people who act like theyre gonna run up to the chair but its obvious they have no intention of making it there ,,,,,
bunch of willfully ignorant people,,,,,
i cant stand ignorant idiots,,,,,
what are the flags for,,,yes,,
guy with the funny jacket and the red hair were crackpotesque,,,,,
something i hate about this format is that its so obvious the people just begin to vote the person off as soon as the doc begins giving his rebuttal,,,yes,,
20 antivaxxers project on a doctor,skeptic,,,,
all of them have crazy eyes,,,,,yes
i think i died 20 times when that red hair woman said hiv doesnt cause aids lets have her get hiv and come back to this show,,,,yes,
dr mike please fix your posture,,neutral,,,
i think when the speakers are voted out and 9 flags are raised instead of instantly stopping them from talking they should be given 1 more minute to speak so that any remaining points can be properly touched on and not interrupted a time limit will give the voters what they want while also giving the speakers a final chance to combat with their argument,,,yes,,
let the doctor speak this is so frustrating to watch fr,,,,,
pack of lies trying to increase the profit of big pharma number conscience despicable,,,,,
the dude who tagged that building must be super proud thats gotta be the worlds lowest graffiti no  lmaz,,,,,
this video is a masterclass in convincing sympathetic listening and addressing people who are less smart and more misinformed hats off to dr mike for holding his ground without making the other side feel lost i believe the people here except the former sheriff who had reasonable points and was amenable had very limited scope of understanding  the reasons behind it would be interesting to know and dr mike showed the best way to deal the situation,,negative,,,yes
some of these people are downright crazy xd,,,,,yes
this whole channel is rotten,,,,,
i admire you doctorbut hepatitis b is not spread through utensils give hep vaccine to  newborn assuming that the mother is unknowingly infected with it and once the cord is cut the newborn will be vulnerable to the virus given the fact that its antibodies supply from the mother was cut off give series of shots to boost its natural immunity against itcharooot,skeptic,,,,
mike,,neutral,,,
this one was a tough watch need to change the format the voting system doesnt give the discussion time to breathe,,,yes,,
i know so many of them rolled up their sleeves for an experimental unlicensed and unapproved shot provided by cartels fined billions for fraud and corruption,,,,,
when enough people raise the flags the current person debating with dr mike gets voted out,,neutral,yes,,
gotha thanks  verbalish ,,,,,
absolutely true as any real evidence is deleted as they dont want to know about another doctors input,,,,,
less smart and more misinformed wow watching your kid fall with a seizure after taking a certain vaccine  and then expressing their experiences makes them less smart,skeptic,,,,
you give shots to boost natural immunity what a load of total disingenuous nonsense to claim that natural immunity is boosted natural immunity is totally compromised by the shots never da never mr a case study of serious autoimmune adverse events following hepatitis b immunization autoimmunity 2005 june 384 295301 reported to vers,,,,,
mistergadomsky4577 tell me you dont understand the human body without telling me,,,,,
 jen1  try asking a question that makes sense without telling me,,,,,
mistergadomsky4577 no youre a waste of time because you have an agenda,,,,,
 jen1  you are a waste of space because you have an agenda,,,,,
4110 weather manipulation weapons is actually an insane take wow,,,,,yes
america lady  we want our freedom of speech back on the internet freedom of speech is law  rest of the world  the internet exists in other countries with different lawsvalues,,,,,
this is painful,,,,,yes
also someone explain to the guy in blue sweater that appealing to experts does not make one an expert especially when it comes to health issues that they do not have any certification for,,,,,
i hope the red haired woman children can escape their mothers thought patterns,,,,,
never once before in history has vaccine immunity been considered better than naturallyinduced immunity from catching an actual disease and pharma actually sponsors and funds medical school as well as medical textbook publication so all the information doctors learn is from pharma pharma knows that they can give vaccines to everybody because they have been made immune from any liability this also means they have absolutely 0 incentive to actually do the proper research they need to do to make vaccination safe,pro-vaccine,,yes,,
sorry dr mike but in this case you are a moon who has not done their actual research none of these vaccines have been properly tested as any other drug or pharmaceutical product not once let alone in the massive combinations they are given in there is so many reasons he is wrong and he obviously has never had a mother who has said something about their child having a major vaccine reaction he has probably said that it is a coincidence these mothers and others here that are vaccinehesitant or anthrax they know what theyre talking about they know the history they know their children and they know what theyre seen,skeptic,neutral,,,yes
the amount of fact checks while antivaxxers are speaking is crazy,skeptic,,,,yes
lack of first principles reasoning and logical fallacies are the real pandemic i am not voicing an opinion on the safety or efficacy of vaccines but rather the complete inability of many people to put together a coherent rationale argument bless dr mike for his patience,pro-vaccine,neutral,,,
not sure about the intelligence of these people poor dr mike ,,neutral,,,
red haired woman said nothing but foolishness  had the fact checker working overtime ,,,,,
i abssssolutely hate the red flags they wont let him talk and get to his point,,,yes,,
why is there all red flags why cant we have green flags to help bring the people together on a bipartisan agreement to help out this divided world,,,yes,,
1 smart person vs 20 dumb,,,,,
jubilee is diabolical for letting some of these people talk on camera to almost 9 million viewers ,,,,,
wasting all the time talking and when the doctor talks they vote out the person never letting him defend his point or answer questions,,,yes,,
i cant even be amused by how dim these people are anymore  its just disappointing,,,,,
132 looks like her gabschase,,,,,
1016 bro is mapping,,,,,
doctor mike say what,,neutral,,,
of what an insufferable mob of clowns,,,,,
dude some people there are nuts the african american guy is the prime example of that,,,,,
3020 a master diverted of answering simple elementary questions a legend of vacuosity the true london is mr michael doc doc ff,,,,,
2410 not every vaccine can create herd immunity but it can create herd protection the grand fallacy of ambiguity and double speak and many others its so self explanatory does mr doc see his error  doc be tripping the hard trip,skeptic,,,,
this doc be tripping all sheeeeeeiiiii,,,,,
arguing with antivaxxers is like arguing with children about whether the tooth fairy is real i know that the tooth fairy is real since i get a dollar each time i lose a tooth,skeptic,,,,
well done dr mike,,neutral,,,
they dont make one brain cell all together,,,,,
first thank you doctor mike for the education to people that dont get the correct information also so excited for this let me get my popcorn its about to be a show,,neutral,yes,,
the best person that has ever been in the hot seat at surrounded i usually get so stressed out at these videos because the debate gets too heated acting with the understanding and science dr mike does is literally the best method,,neutral,yes,,
imagine the preparation of these antivaxxers hhh im gonna get dr mike on these points   ill bet hes never heard of this random study that i heard about on infomark im gonna get him   i cant wait to see the look on his face when i tell him about this one time this one thing happened and that caused something bad to happen dr mike is in for it today,skeptic,neutral,,,
this dude at the 56 minute mark is an aspiring actor just wants any platform he can get to show how capable he is ,,,,,
ive never seen one of these before but how do they recruit for it do they put out a casting call for crazy people,,,,,yes
in my opinion audience should be allowed to vote another audience member but the doctor should have recent time to answer now it felt like the audience didnt even wanna hear what the doctor had to say,,,yes,,
her anecdotal stories are absolute nonsense,,,,,
boy do anti vaxxers make me feel smart,skeptic,,,,yes
1125 shut it down people this dude said treating each other with respect and free media prevents diseases,,,,,
correlation does not equal causation,,,,,
i must say i had a huge prejudice against people who are antivaccines  seeing them debate has clarified how this scepticism emerged and made it look less unreasonable  i see two main causes for their opinions 1 scientific illiteracy especially concerning statistics 2 complete distrust of the government im afraid i wouldnt trust us government if i lived there either particularly not with that lunatic presiding it now still from distrust to believing conspiracy theories there is a long way to go,skeptic,,yes,yes,
nelle is afraid of vaccines but not the byproduct of the botulinum bacteria being injected into her face,skeptic,,,,
yo red hair girl is legit fact checked for every single point  like how do you get yourself so misinformed ,,,,,
that red haired woman is probably giving the anthrax community a bad rep by existing,,,,,
get those flags out of the find episodes,,,yes,,
it surprised me how quickly they voted people out,,,yes,,
why tf they voting each other out so fast seems to me like they dont care to learn even from their own kind they all just want a chance to talk so they can prove how smart they are for attention or whatever its sad,,,,,yes
cool doctor ,,,,,
some of these people are well jubilee has a level of responsibility to not exploit vulnerable people,,,,,
