cleaned_comment,vaccine_view,about_doctor_mike,format_criticism,misinformation,emotion_personal_experience
it was a strategic choice to not invite any actual educated and experienced voice within this debate  and instead collect a bunch of relative random to muddy waters and perpetuate the stigmatization against anyone who questions vaccines this was a setup jubilee does this often throughout most of their episodes ,skeptic,,yes,,
do you wear a seat belt  sometimes  hmm,,,,,
what book did dr mike recommend reading,,neutral,,,
a claim is nothing without reasoning,,,,,
 theinformedtoast3377 i dont want the ingredients that are found in vaccines in my body how is that for reasoning,skeptic,,,,
 jaycubnum33r did you not listen to what mike said to your concerns,,neutral,,,
 jaycubnum33r  most of what is in a vaccine you find in a banana your opinion is baseless and your claim is wrong,skeptic,,,,
you saying youre wrong without any reasoning shows me how ignorant and informed you are about vaccines,skeptic,,,,
no hes not,,,,,
bro what,,,,,
proof that vaccines work is having no more polio no more smallpox and we can go down the list we are beginning to see these diseases again because of all the anthrax and people coming to the country that arent axed and to say hiv doesnt cause  aids is mind blowing,pro-vaccine,,,,
this doctor is brought to you by prize d,,,,,
2255 the notion that vaccines cause a force field and prevent disease is a fundamental flaw in their education,pro-vaccine,,,,
this is unwatchable the combined iq of the all anitvaxers has to be less than dr makes iq,skeptic,,,,
poor tom doesnt know that his three daughters ought to get fascinated not only for their safety but for his as well,,,,,
americans ,,,,,
not even gonna watch it just wanted to confirm the comments would be nothing but slug people appealing to the dr label,,,,,
fact checks could not keep up with the one woman sewing out misinformation lol,,,yes,,
i cant stand these videos the specialist barely has the time to respond,,,,,
even without the title or having no knowledge of dr mike i can tell really well that he belongs to healthcare   greeting people first  showing them with compliments and congratulations them all these are indeed  medical practices  these professionals are trained to listen amd be patient,,positive,,,
do a debate with candle owens thats what i want to see,,,yes,,
this format is about as productive as speed dating,,,yes,,
hi guys,,,,,
okay fine ill be the one to say it what do you think dr michael varshavskis religious beliefs are and how would that be relevant here  do you think he gets an extra bonus for coming on this podcast to defend the lobby as well or do you think it only counts per person that gets it,,,,,
he doesnt have 14 millions subscribers because he is against big pharma,,,,,
what would have prevented this all was the lockdown    if we were all told to wear a mask voluntarily without locking down the world we would not have been skeptical  to shut down the world was an experiment just like the genocide in palestine is an experiment  the 1 on top need to sit on the chair the doctor is sitting on  we have questions for them,,,,,
i love the transparency the new generation promotes   the new generation are a  special generation,,,,,
i wish i could be on this panel these arguments are sad and poorly done on both sides,,,,,yes
the lieutenant is very intelligent,,,,,
trust the independent reviewers but he doesnt know who the most published cardiologist in the history of the world is  here is a list of real doctors some which has 40  years of experience not some random  be youtube wannabe   dr robert malone  physician and biochemist  dr eric payne  pediatric neurologist  mater in public health   kevin mckernan  genealogistpharmacology  david j spieler  molecular biology and epidemiology   dr maria gutshci  pharmacist regulatory specialist   dr laura branded  molecular biologist senior research scientist   dr masanori fukushima  most senior ecologist   dr steven quay  physician   dr jessica rose  viral immunologist  dr james thorn  dr jordan young  founder and president of the microvascular research foundation  dr sudan humphries  american board of internal medicine in both internal medicine and neurology  dr jack launcher prof theresa pretorius and professor douglas well,,,,,
looks like you are a triggered snowflake   china still,,,,,
your even worse than the antivaxxers who read and watch medical studies because your refusing the data and clinging onto your idea that vaccines are bad maybe the people who side with so called dr label are actually intelligent and logically thinking people who have read and watched medical studies,skeptic,,,,
go ahead state your case what makes you or any of these anti van people more reliable than the dr label,,,,,
you got triggered by the title of a video  snowflake,,,,,
i would argue even less so speed dating from what i know has actually led to relationships a handful of times,,,,,
 what does his religious beliefs have anything to do with vaccines,skeptic,,,,
yeah i cant watch this all i hear is emotional manipulation from everyone the doctor included,,,,,
 sure big brain   you are definitely smarter than everyone,,,,,
2900 bro ur not ben shaping stu,,,,,
the first one is an actress,,,,,
whats the point of voting them out,,,,,
i dont care for the voting out by majority no one can get their questions properly answered nor dr mike can get his answer across,,neutral,,,
girl talking about hivaids shouldnt be related sorry that comment was crazy,,,,,yes
nursing your kid until 7 ,,,,,
stay away from any doctors who tell you to take the vaccine,skeptic,,,,
5245 with is she on about,,,,,
the votes out should be limited a number of times per person or per claim also each person should have a minimum of 5 mins to lay the grounds for the convoy and case their points in order to have a proper debate so that they dont get judged and voted for just one wrong thing they said thats not how debates work,,,yes,,
at the end of the day it is your life and your decision you dont want the vaccine dont get it but dont force your beliefs on others and it should be the same with people who gets all their shots people shouldnt be villainized because they dont get fascinated,skeptic,,,,
doctor mike vs 20 conspiracy theorists,,neutral,,yes,
2139 interesting that as soon as the lunatic stop speaking and he begins his response people start voting to stop him speaking  idiots all the way down,,,,,
ive never felt so sorry for so many people in such a short time,,,,,yes
he so fine,,,,,
2925 blue thought he cooked so hard ,,,,,
so dont get a vaccine take your family and move onto a  farm and see how healthy become,skeptic,,,,
dr mike vs activists and lunatic,,neutral,,,
1341 ok but listen the vaccine was to protect the older ppl from the children they would come into contact with i really hope doc hits him with that fact,skeptic,,,,
the guy with cool jacket did very well,,,,,
dr mike is too nice get dr house on these weird,,neutral,,,
i support people doing what they want with their bodies but i dont understand why the people referring to one of the women in the video who get book lip filters and plastic surgery are so afraid of western medicine youre injecting yourself with actual toxins that have more proof of death caused then vaccines i dont understand this logic,anti-vaccine,,,,
5438 the energy from this lady is so off plus more to the point she talks a helluva gotta white,,,,,
the fact that these people believe they are on the same level of knowledge as a board certified doctor tells me how absurd our society has become,,,,,
022,,,,,
i took sputnik v vaccine 3 times  and i never had any health problem,skeptic,,,,
the irony most refuse to see all vaccine injured are not anthrax to state that they are is only more telling of the finger pointer,skeptic,,,,
ancestral intelligence real ai when do these people stop making word salads and realize it actually sounds funny,,,,,
this format is not working instead of having the opponents rambling on for half the time and then being instantly voted out when the other side starts to argument against them just doesnt work all your doing now is giving the jumbo jumbo more time to spec out their insane theories and not giving any time to actually debut them change the timer so that there is only like two max three minutes for the initial counterargument and then the professional has all the time they need to answer that then change the person on the seat no need to vote anyone out,,,yes,,yes
pseudo intellectuals vs a doctor,,,,,
the same people who dont want public health care are the same ones complaining about the free market and pharma reps,,,,,
people dont understand the difference between the correlation  and causation and it shows,,,,,
doctor mike should be sent to prison for being this ignorant what a scuba pos,,neutral,,,
vaccines cause more illnesses  cup u literally get a super small part of the illness so your body can build its immune system around it,skeptic,,yes,,
my mum got a reaction from the vaccine what a crazy argument what happened to imperial facts that young girl has a lot of trauma in her life what a suitcase,skeptic,,,,yes
roots deadass just talking about race and culture,,,,,
women in the red is the crazy aunt who lives with cats and spends all her time in the internet,,,,,yes
these people far too much time on the internet while this guy spends his life saving people while these moons actually think they are more useful,,,,,
the doctor is a very religious person i admire his unconditional faith  in the vaccines and the pharma industry,skeptic,,,,
black with reads is far gone,,,,,
imagine being a doctor and having to talk to these moons the patience it must take,,,,,
i  agree,,,,,
freedom of speech baby,,,,,
sadly they do look at all the mass deaths that have been happening in the last 4 years or the epidemic of autism in children,,,,yes,yes
 不幸屋の娘o6l   autism is not caused by vaccines im guessing you didnt fact check anything or even saw the correction about the vaccines cause autism smh,anti-vaccine,,,yes,
 不幸屋の娘o6l did you not see what mike said about it he pointed up how theres multiple debuts theres many studies evidentially debunking,,neutral,,,
they arent moons theyre the sane people here youre either a bot or live under a rock,,,,,
i just want people to realise this is supposed to be a middle ground,,,,,
the hiv doesnt cause aids lady did not come for a discussion my lord thank you for not having me to live and listen to someone like this,,,,yes,
952 the vaccine ,skeptic,,,,
telling a doctor that hiv does not actually cause aids is wild actually it might be the widest thing ive ever heard,,,,,
the dude in the blue shirt and the red haired lady omg the things they said had me shook,,,,,
12958   imagine being so miseducated that that peopleloving dude had to participate on the successful attempt to censor dr mike by using those flags with bad faith ,,neutral,yes,,
who remembers the sideman meme where his laying down on the hospital bed this comment gave me aids  4050,,,,,
this was a hard watch i cant believe people live like this,,,,,
the problem with vaccines is that is no real possible comparison on our modern world since almost everybody in the west is vacated there is no way to tell how it would be without vaccines there can only be speculation or arguments based on the times in human history or other places in the world that in no way are comparable to our contemporary one,skeptic,,,,
dont act like you are a victim,,,,,
if he cared about his mom he would have done this differently,,,,,
hes a terrible son,,,,,
bunch of idiots dont know how facts work,,,,,
i love doctor mike extremely patient respectful breaks it down in understandable ways being humble and gentle can be the only way to get through to people at times,,positive,,,
my follow up question should be why am i such a dumbarse,,,,,
religion is a pest,,,,,
 walks up to a doctor  did you know,,,,,
love the head shake in the background at 2309,,,,,
doctor mike is too polite we need house in real life,,neutral,,,
its insane to me about how this whole format is just let me get my point across screw everyone else here not even 1 second that the first lady is up she has ¼ the votes needed to be voted out they should implement at the very least a delay for voting to maximize the interaction instead of making it be a thing where they get voted out as soon as they get up there,,,yes,,yes
youre a bot everybody hates him now he may seem nice but hes a criminal,,,,,
 不幸屋の娘o6l  your the bot i see you commenting all over the place seau,,,,,
 deeznutsff4zn  they just want attention lol,,,,,
im halfway through and just please let other people talk its the same 4 people going up and mapping,,,,,
this video pissed me off hiv doesnt cause aids are you okay holy we are so screwed,,,,yes,yes
its so uncomfortable to watch doctor mike is calm and professional and clearly knowledgeable all the participants once it reaches a point of actual factconversation and not emotional as the participants are raise the flags to just get their rant going having a mature conversation with people who clearly only want to range their point across rather than being open minded about what information they are getting wow what a waste never discuss with idiots they drag you to their level and beat you with experience is what comes to mind here  this format is just terrible kudos to dr mike to have this patience,,positive,yes,,
dr mike gets paid  to lie,,negative,,,
dr mike is soon sole i cant focus,,neutral,,,
dr mike is a still pos  the cov1d vaccine is poison,skeptic,neutral,,,
damn doctor mike has aged 10 years since he fascinated,,neutral,,,
this episode just makes me hate antivaxxers  theres no discussion ,skeptic,,,,
in the prize c19 trial there were more deaths in the vaccine group than the placebo group 22000 doses and not 1 life was saved extra people died,anti-vaccine,,,,
youre not fact checking at all its just a money generating advertising show,,,,,
1900 doctor mike didnt even need to be there the fact checkers put in work,,neutral,,,
people need to start researching and educating themselves about autism cup wtf,,,,yes,
you should know about these patents since your offering these medicines no excuses,,,,,
mike touched for dr face dont believe him,,negative,,,
ive been barefoot for the last 15 years ,,,,,
there are plenty of doctors and scientists who would have debated the costbenefit analyses for different cohorts  immunization tech  perhaps most relevant to the mra tech faithful would be robert malone he is the first scientist to theorized and demonstrate deliverance of mra using lipid nanoparticles,,,yes,,
there shouldnt be any religious excuse to back out of a vaccine not going to be put at risk because of someone delusion,skeptic,,,,
these people are so weird nursing a child to 7 wtf,,,,,
this doctor possesses a level of calm i will never come close to approaching,,,,,
these people are all idiots only the cop with the gate presented a logically formulated argument,,,,,
probably cause he got fascinated more then 10 years ago,,,,,
he didnt hes neither a fool nor a suicidal person he only promotes this poison to others,,,,,
this something is very off about this whole channel and what its trying to accomplish,,,,,
and the ladies reaction  lvaro,,,,,
just have doctor mike talk to rfk jr directly  or someone well versed like del bigten,,neutral,,,
mfa this was not a debate also the red haired chick in the all denim outfit is hilarious,,,yes,,
the amount of uneducated viewpoints some of the people had truly shocked me i applaud the amount of patience the doc had as some of the people became repetitive on their baseless arguments as the major flaws those arguments had became apparent mid conversation is truly remarkable of course there also were people who were open for an actual conversation and a readiness to look at the whole situation from another angle which just shows that there are victims of misinformation being in a echo chamber full of baseless statements its very sad seeing these people being so locked into their view that they lose their ability to critically think about the topic of course there are also faults with the healthcare system and money plays a key role as to why those problems exist in the first place nonetheless the fact remains excluding everything around vaccination the principal behind vaccination is and has been scientifically proven to be effective since the beginning of mankind as it in most cases merely simulated an infection with the the real agent that people cant get behind the simple logic of a vaccination is what fighters me the most,skeptic,,yes,,yes
1120 he implies that one way of preventing illness is connecting with nature but all the illnesses that vaccines are protecting people against are derived from nature although nature is beautiful and in some ways wonderful and magnificent mother nature is still truly hellbent on destroying humans otherwise vaccines wouldnt need to exist in the first place,pro-vaccine,,,,
,,,,,
you cant argue with facts with people who are not willing to deal in facts dr mike is so patient with these people everyone should be required to take an iq test prior to being allowed on this show ,,positive,,,
this wasnt a debate the doctor was fighting with the american educational system,,,yes,,
make is a worthless pianist still dont listen to it,,,,,
as soon as dr mike starts making sense they all start to vote out the person to try shut him up,,neutral,yes,,
why are they cutting out parts of the conversation,,,,,
i wonder if these people question their car mechanics lawyers accountants plumber electrician vac specialist carpenters etc etc when they need their services,,,,,
people not understanding that the rate that people have autism isnt increasing its the number of autism diagnoses that is increasing will never not be frustrating to me,,,,yes,
red headed lady needs help asap,,,,,
colonies brought smallpox yes definitely they infected native americans intentionallywith blankets of course but you know what eradicated smallpox in the 20th century   smallpox vaccine americans are pretty ignorant its pathetic,pro-vaccine,,,,
the overlap of the 20 participants with sam sewers vid  the 20 anti vs 1 pro lgbt vid is hilarious but surprising ,,,,,
doc is a hero for keeping a straight face with some ppl,,,,,
all men and women know it is wrong to polluted a stream and yet the same people polluted their bloodstream with chemicals toxins preservatives bovine serumetcetc  vaccination from its origins has been a scam and their is more than enough evidence and information so one can conclude and deduce such,skeptic,,yes,,
even the voting pattern shows that these people are not there to listen they are there to just say things that they have read from social media and they dont care if they are true or false and they prefer social media over a person that has the knowledge this is the mental illness that is needed to be treated,,,,,
we see the fact check but do they because theyre going to walk out of there still believing all those,,,,,
that first girls baby is going to get the beubonic please,,,,,
ok i wont listen to make id listen to mike,,neutral,,,
funny enough the first guy who brought the idea of violation to combat smallpox to the usa was a west african by the name of onesimus,,,,,
a vaccine doesnt polluted your body it exposes it to a virus or illness so it can combat it in a simulated environment stimulating the body most vaccines work this way,pro-vaccine,,,,
i would ask you to give an example of evidence but i already know you wont be able to find any,,,,,
bunch of losers,,,,,
hygiene practices increase tremendously along the same timeline as vaccines so the hygiene we take for granted in our plumbing infrastructure and water systems were not around centuries ago and thats also a contributing factor to the bacteria in the viruses we had that we dont have anymore,skeptic,,yes,,
how about being a villain and a hero of a constructed crisis how about having the power to provide a cure as well as the power to withhold it how about broadcasting specific ideas while censoring others,,,,,
kudos to dr mike for not losing his cool a vast majority of these people sat there talking at him rather than even remotely trying to have a conversation with him,,neutral,,,
nutjobs come in all shapes and sizes  there were 17 not 20 as billed of them on this panel and id bet real money that no two of them shared the same exact viewpoint  seventeen people all with a different axe to grind so any time one of them gets the chair theyre quickly voted off by the other 16 not because the other 16 agree with each other but because each of the other 16 wants to take the chair so they can grind their preferred axe  this entire affair was an exercise in futility,,,yes,,
it took me the whole month to make it though this video and not because it was long lol,,,,,
this series is a clear indicator of how doomed the us is,,,,,
they see what they want to see 216,,,,,
610 this is where logic fails  so if you took the protection why would you need others to some must really enjoy getting slammed i came here to lose faith in humanity and i am not disappointed  738  1038 so its only 3 minutes each which became a monologue then conveniently he did not have to answer i think ill stop watching here,,,,,
sorry but the red haired woman is really annoying,,,,,yes
the format of these videos needs to change to be more productiveeffective,,,yes,,
i love how they fact checked all them and they were wrong thats the point of the video doctor mike was great ,,neutral,,,
i would have liked to see mandate owens on this roster,,,,,
that red haired middle age woman is a nutjob,,,,,
stop saying vaccines cause autism when there is zero evidence,anti-vaccine,,,yes,
10139 is he gonna cry,,,,,
doctor mike vs 20 nobody  surrounded,,neutral,,,
really hope you washed your hands after shaking all them dirty hands doc lol,,,,,
this format would benefit from having the claimant explain the claim first this is just rambling,,,yes,,
what i learned from this is that dr mike and me and some others who watched this whole video have a tremendous amount of patience ,,neutral,,,
he wouldnt have survived that discourse,,,,,
theres a lot of evidence but it gets silenced,,,,,
 不幸屋の娘o6l  link your proof and we will change our minds,,,,,
 不幸屋の娘o6l  there is also a lot more evidence that it is not true because there is no evidence that it is,,,,,
that woman at the end is just plain mental,,,,,
just a reminder that these people can votelmao this is crazy,,,yes,,yes
choice,,,,,
i know this video is going to annoy me and yet i clicked on it and im going to watch the whole thing,,,,,
why are they raising flags before even listening,,,yes,,
heaven forbid but when his children get fascinated he will see how it affects them,,,,,
this dude is the best communicator i have seen in my life its awesome how he swallows his ego and takes the opportunity to educate,,,,,
hahahaa rfk has asked many times for a debate and no one has been able to go through that conversation yes better go with 20 students and pretend your are smart i think it would be better if you speak with any other doctor with different perspectives that can lecture you on the topic ,,,yes,,
poor naive dr mike wait until he gets plugged by the system,,neutral,yes,,
what we need is immunology specialists on here not regular doctors theres a big difference in their knowledge,,,,,
i think we can all agree the rhead girl is the most disrespectful and unfit person to be in a debate,,,yes,,
i cant believe i just witnessed a woman telling a health professional that hiv does not cause aids probably a flat farther too,,,,,
these people vote out the person before mike can debut or destroy their arguments,,neutral,yes,,
the third dude went in without any intention of having a debate he went in to proselytize talking about the anh like its a medical device that heals and such,,,yes,,
people ask me whether their children need vaccine i ask them whether your son needs helmet when he rides motorbycicle the answer to both questions are same,skeptic,,,,
any notice when doctor mike said vaccines didnt cause austin 6 people red flagged him,skeptic,neutral,yes,,
nursed till he was 7 mmmm,,,,,
wow these people pigeon logic conspiracy theories poor understanding of the facts basic biology they just want a platform to speak because no one else will listen to their nonsense well done mike youre a better person than i,,neutral,,yes,
this doesnt make sense the worry that someone doesnt take a vaccine can put others at risk its almost as if you are saying the vaccine will not work or protect those that did take it the only people that should be affected by disease is the others that did not take a vaccine by choice and i am sure these people understand that risk 616,pro-vaccine,,,,
the problem is most doctors are not like him my doctor told us when we were going to get our kids fascinated that there are never side effects to vaccines and they are 100 safe my daughter had a couple different vaccination and about an hour after the mm vaccine she developed a very bizarre reaction with raised lesions all over her body and a high fever the doctor said its just a coincidence but i really lost faith in what they say because ive had multiple doctors lie to me,pro-vaccine,,,,yes
is forcing your children not to get fascinated a choice too,,,,,
