cleaned_comment,vaccine_view,about_doctor_mike,format_criticism,misinformation,emotion_personal_experience
its important to look at the full picture based on evidence not fear or hypothetical vaccines are among the most rigorously tested and continuously monitored medical tools we have while no medical intervention is 100 riskfree serious adverse reactions to vaccines are extremely rare  even dr mike has acknowledged this multiple times  hes been very clear that vaccines do carry some risks just like any medication but he also explains that the benefits far outweigh those risks when you look at the data vaccines prevent serious illness hospitalization and even death  not just for the individual but for the community  wishing harm on someone children to prove a point isnt helpful or fair the real goal should be making informed decisions based on scientific evidence and compassion  not fear or blame,pro-vaccine,neutral,,,
im sure he wont vaccine them he knows perfectly that its harmful he only promotes vaccines to others because he gets paid for it,skeptic,,,,
absolutely true they wouldnt dare put mike dr up against some real scientists who dont work for corporations,,neutral,,,
watch the last interview of doctor mike with dr peter hotel who refused a debate with rfk and you get an idea,,neutral,yes,,
kerry mulls nobel prize winner and inventor of the  rt per test says you are wrong maybe you need to do some proper research before you sport the corporate line,,,,,
"yes vary mulls invented per and won the nobel prize but his views on hiv and aids were highly controversial and not supported by the scientific community despite his achievements mulls denied the link between hiv and aids a position that has been thoroughly discredited and widely criticized by experts and researchers worldwide the overwhelming scientific consensus backed by decades of evidence is that hiv does cause aids citing mulls to refute this is misleading and ignores the massive body of research that proves otherwise  its like if a brilliant car engineer who invented a revolutionary engine later claimed that seat belts dont save lives just because theyre an expert in one area doesnt make their opinion correct in another especially when decades of safety data say otherwise in the same way muslims invention of per doesnt validate his personal beliefs about hiv which contradict extensive scientific evidence",,,,,
at this point it would be a blessing for her to be a flat farther instead of antivaccine at least she wouldnt risk other peoples lives while blabbering about the earths shape,skeptic,,,,
helmets dont cause autism and deaths,,,,yes,
 不幸屋の娘o6l  vaccines dont either you ignorant fool,skeptic,,,,
a vaccine isnt a perfect protection and it will never be it just stimulates your body to defend better defences fall if exposed too much if you have a fireproof jacket you still wont throw it on a building catching fire and after the fire goes out expect it to be intact,skeptic,,,,
maybe he meant its 100 always better and safer to vaccine your kid than not to,pro-vaccine,,,,
mike got the patience of a saltwater crocodile,,neutral,,,
claiming ignorance when cornered on something he cannot answer  spin reasonably i can respect his open handedness but surprise surprise avoidance in a convoy,,,,,
i am amazed that our education system has failed us so horribly its sad there are so many ill formed and ignorant people in our society i was a mortician i had to transfer paper records to the computer at a funeral home in rural kansas if you look at deaths before vaccines its obvious vaccines save lives if you dont think vaccines work the proof they do is written in stone just take a walk through an older cemetery especially baby land for those that dont know many cemeteries have a special place set aside for little ones whose families have no plots and can not afford one its referred to in the profession as baby land,pro-vaccine,,yes,,yes
the vast majority of these people are religious conservatives  are anti science and are prone to conspiracy theories,,,,yes,
i see that brown guy with the slick hair went to the ben shaping school of debate,,,yes,,
this is actually a show about the inability of people to listen and learn,,,,,
one thing i love is seeing people say false claims and then being factchecked by the san factcheck pop up,,,,,
love the uneducated dt  the future of our country,,,,,
this doc would be a great politiciandiplomat but should have spit out the truth with no filter,,,,,
the thing that stood out to me most in this video is how the antivaxxers let each other go on their rants to the doctor but as soon as he starts responding they start raising their flags most of them had no intention of debating here they just let their side gamble on and then raise their flags cutting off dr mike before he even gets a chance to respond properly weak,skeptic,neutral,yes,,
the irony is that all of these antivaxxers are likely fascinated,skeptic,,,,
theyre not even arguing anything about vaccines but just rather giving off topic speeches about health or some random anecdotal,skeptic,,,,
something is wrong with the american education system most americans are unable to differentiate facts from opinions thats scary,,,yes,,
emotional intelligence ,,,,,
im sorry but i just dont feel you need a vaccine for something classed as low risk with fatalities,skeptic,,,,yes
the flags are a terrible debate and discussion format,,,yes,,
it must have been so fringe for dr mike,,neutral,,,
this is hilarious its just a parade of conspiracy theorists going since we know that ____ is true and we know beyond a shadow of a doubt that its not true how are you going to make me feel better about what i imagine you did,,,,yes,yes
dude at 2940 is same dude who thinks gays should just be straight  very ignorant misinformed religious fanatic,,,,,
these people have the privilege to question vaccines because of how well they work,pro-vaccine,,,,
there was only one dude who wasnt one of those and was pretty respectable to the doctor,,,,,
the most based people,,,,,
we have a highly profitable product vaccines because the safety testing isnt as rigorous as a pharmaceutical drug the gold standard is double blind placebo based long term study  that isnt the case with vaccines because their classified in a different way as a public health measure    they havent been tested in combination with other vaccines yet docs give 69 doses per visit if a pharmaceutical drug was tested like this it wouldnt be in the market but because theyre vaccines  the safety tests are less rigorous our children are being experimented on,pro-vaccine,,,,
i actually support these antivaxxers i appreciate the role theyre playing in natural selection,skeptic,,,,
the system of voting off in this video is very flawed people are just voting others off because they disagree with dr mike,,neutral,yes,,
i dont like what the doctors answer are in my thought bubble  skip  he isnt hands down agreeing with what im saying  skip i dont believe what the doctor is saying  skip   the antivaxxers,skeptic,,,,
but when i win a 20v1,,,,,
how just they cant understand that if some things have pros then it also have some cons making up a whole perspective on cons without batting an eye to the pros is hilarious,,,,,
antivaccers are more impatient than atheists,,,,,
i like the fact that the minute dr mike starts to speak 8 flags are up,,neutral,yes,,
brother some of them like paranoid alien flat farther enjoyed everything everyone everywhere out to get them lol,,,,,
im not fascinated and ive never had this disease thats because everyone around you is and so they cant get it to give it to you,,,,,
matrix they brought a bunch of people who are not well spoken and made the doctor to lecture them this was so dishonest there are a bunch of very well spoken and intelligent antivaxxers who could have a productive conversation with this doctor  most likely we will have another pandemic soon and the matrix is hungry to profit on vaccines while helping with population reduction that is what loyalists want more than anything and we see the amount of bots at the comment section validation this sorry not this time daddy,skeptic,,,,yes
20 people with anecdotal evidence vs a guy who knows all the mantra he was indoctrinated with through his pharma funded education lets get some experts on both sides to debate the topic,,,yes,,
20000 out of 21 million is about 9 percent of child deaths after vaccination,anti-vaccine,,,,
all these people here are moons except the doctor,,,,,
did people witness differences in a new generation and just decide to universally blame vaccines,skeptic,,,,
some vaccines are necessary and we take them for granted but if we are being honest a lot of the vaccines are for profit and are not for necessary,skeptic,,,,
i think the question shouldnt be anthrax its the trust in healthcare system to not be profit based,,,yes,,
best part about antivaxxers is that they dont even like listening to people that agree with them on the issue because its always some insane fringe issue the person brings up,skeptic,,,,yes
everybody voting when they dont like what the doctor said  none of these people wanted a real debate they just wanted to have fun yelling at a doctor,,,yes,,
love you dad,,,,,
vaccines are tested way more than the average pharmaceutical drug which he outlined in the video but because you crowd dont actually try to learn things and just spec the same thoroughly debunked script im not surprised,skeptic,,,,
domonocdoctor total garbage the 76 shots that children in this country receive  none of them have been safety tested in prelicensing studies against a placebo which means we dont understand the risk profile for those products,,,,,
with is hilarious since most of them are believers,,,,,
its important to focus on the facts rather than assumptions about motives or who was chosen for the conversation the video showed a doctor calmly addressing common misinformation  and the goal was to clarify science not stage a lecture  the idea that theres some global conspiracy using pandemic to profit or control populations is a serious claim but doesnt stand up to evidence vaccines have saved millions of lives worldwide and are developed and distributed by countless scientists and health professionals working independently across many countries  as for the comment section online spaces can attract all kinds of opinions  including bots and trolls  but that doesnt change the overwhelming scientific consensus or the refworld benefits of vaccination  if there are wellspoken critics with valid points open dialogue is always welcome but the science behind vaccines isnt a matter of opinion or debate  its based on rigorous research and data its important to separate genuine discussion from misinformation and conspiracy theories,pro-vaccine,,yes,yes,
i get the frustration with feeling like education can be influenced by funding but the truth is that scientific knowledge isnt just mantra learned blindlyits built through rigorous research peer review and reproducible evidence over decades doctors and scientists are trained to question test and update what they know based on data not just repeat what they were taught  on the other hand anecdotal evidence from 20 people while personally meaningful doesnt hold the same weight as largescale studies involving thousands or millions of people personal stories can be powerful but they cant replace objective scientific methods that help us understand how vaccines work and their safety  regarding experts debating both sidesscience thrives on open discussion but its important the experts on both sides are qualified and base their arguments on credible evidence too often called experts opposing vaccines rely on misinformation or discredited claims which doesnt make for a fair or productive debate  the best approach is to listen to qualified professionals who base their conclusions on the full body of evidence rather than isolated anecdotes or conspiracy theories,pro-vaccine,,yes,yes,yes
 bignoseenergy turn the ai off and think for yourself,,,,,
2000021000000000095 last time i checked 009 percent is not 9 percent,,,,,
are you slow,,,,,
009 in reality,,,,,
your high school mathematics teacher just had an aneurysm because of this comment,,,,,
its true that vaccines have become a routine part of healthcare and sometimes it feels like theyre just taken for granted but the reality is that most vaccines we use today have been developed because they prevent serious sometimes deadly diseases the goal has always been to protect public health not just profit  while pharmaceutical companies do make money from vaccines they do from most medicationsthat doesnt mean the vaccines themselves arent necessary or effective vaccines undergo rigorous testing for safety and efficacy before theyre approved and public health decisions about which vaccines to recommend are based on extensive scientific evidence not just profit motives  its important to separate legitimate concerns about industry practices from the overwhelming evidence showing that vaccines save millions of lives every year profit doesnt negate necessity instead transparency and regulation should be the focus to ensure vaccines remain safe effective and accessible,pro-vaccine,,,,yes
i respect religious beliefs but that green dress lady had della eyes,,,,,
3500,,,,,
that dude with the reads talked about everything other than what was required lol,,,,,
im gonna be so respectful when i say this since its youtube but the woman with the jean jacket has noon medical knowledge whatsoever proven tests to show that autism isnt caused by vaccines and she just sits here and says its not true then to say hiv doesnt cause aids omgggg,anti-vaccine,,,yes,
how could doctor mike be so wrong about rfk jr hopefully he sees the light,,neutral,,,
theres nothing behind the eyes of the first lady full blown nuts,,,,,
telling a doctor that hiv does not cause aids is nonsense first of all and second of all being pedantic towards a doctor by telling them nothing that you say will change my mind because i have studied is crazy disrespectful,,,,,yes
i think its an interesting topic but the only thing that i kinda disliked about the debate is that the doctor barely has time to express his opinion just a few seconds before he has to be interrupted because of the people raising the flags while the others can tell their opinion with no problem i suggest that you should at least let the guest briefly finish telling its opinion before changing to other people,,,yes,,
i dont understand how someone can say hiv doesnt cause aids  what articles is this women reading,,,,yes,
1748 everybody shaking their heads yet you know they dont have a single piece of data or logic that disprove makes claim,,,,,
why did this play exactly the way i expected dr mike is so patient and respectful they are so into their mob mentality they cant stand listening to sound and logical arguments it takes balls to sit in front of an actual doctor and tell him to his face that he is wrong because they did their own research  pd props to the bernie guy he was the only one willing to listen,,positive,,,
what a respectable doctor,,,,,
hey never watched something like this before but what does the raising of the red flags mean hopefully they explain it at some point or i can figure it out with context but i am 3 min in and just confused,,,yes,,
11357 undercover cher,,,,,
hes looking plump lately,,,,,
every kid in the 60s and 70s had chicken pox mothers would have chicken pox parties where they would purposefully expose their kids to other kids that had it just so everyone could get it out of the way  vaccines came along and now its rare in kids just like jumps measles shooting cough etc,skeptic,,,,
what do we think is the average iq of the twenty,,,,,
a quality of a highly intelligent person is listening to number people telling them stuff they know arent true amd smiling and listening ,,,,,
743 guy was based actually,,,,,
certified dr vs 20 online polemic,,,,,
yeah he was respectful but drifted hard off the topic,,,,,
"doctor mike isnt wrong about rfk jr  hes aligning with the overwhelming scientific and medical consensus rfk jr has promoted a number of discredited and misleading claims about vaccines and public health many of which have been thoroughly debunked by experts across multiple disciplines while hes entitled to his opinions those opinions have serious consequences when they contradict solid evidence and influence public trust in health measures that save lives  doctor mike as a licensed physician has a responsibility to rely on peerreviewer evidence established science and public health data  not conspiracy theories or anecdotal claims if anything hes doing exactly what we should want from a health professional critically evaluating the facts and speaking out when misinformation puts people at risk  hoping he sees the light assumes that rfk rs position is the truth  but in reality its rfk jr who has repeatedly ignored the light of scientific evidence",skeptic,neutral,yes,yes,
light,,,,,
didnt take long to figure out xd lol got it ignore but please mike continue,,neutral,,,
also like as soon as mike starts talking everybody votes to end the conversation like tf is that about allow him to talk did you sign up to debate or sign up to complain to mike and not even give him a chance,,neutral,yes,,
unabomber mindset,,,,,
 block1 yeah on some things but it was offtopic,,,,,
disappointed  missed on picking debates on both sides of this one this is so elementary compared to other debates by jubilee,,,yes,,
wooooowinsane,,,,,yes
3826 rfk publicly and under oath told the american public to not follow his advice for medical decisions,,,,,
2240 this woman made a huge deal about listening to all sides of a conversation when dealing with health issues then proceeded to entirely write off any sort of mainstream scientific viewpoint because they dont line up with her holistic medicine narrative she actually pissed me off ,,,,,yes
the facts are we have increased the number of vaccines 10 fold over the past 6070 years and diseases and illnesses have increased 10 fold at the same time so are these vaccines really helping us or are they contributing or even creating it,skeptic,,,,
is this guy a doctor because staring shut down while moons gray nonsense is not a very academic attitude is it,,,,,
a skeptic is not more likely to be mislead hes more likely to investigate the guy talks about miss information and doesnt even have the other side of the information,,,yes,,
1600 document athletes  they had issues more than doctors because graphene oxide pumping through the system messed them up others got lots this guy is a joke,,,yes,,
one statement on papers and he is a threat lol what about face  and what if  this doctor never seen research on papers peppers this guy doesnt know the main doctors and research on the other side,,,,,
poor dr flabbergasted by the question who is the author of misinformation lol,,,yes,,
wow doctor mike is the hero we need and the hero we deserve,,neutral,,,
doctor mike vs 20 darwin award nominees,,neutral,,,
unbelievable patience with these folks the beheaded lady was profoundly difficult to listen to,,,,,
taking the way he listens and responds as something to strive for personally,,,,,
the doctors examples and arguments are pitiful  hes not addressing the two big elephants in the room  why are there no placebo controlled safety studies of vaccines and dont give me the crap that its unethical to not give a group the vaccine  we cant know safety without a control group and we use controls for life saving heart mens and everything else  also why are the manufacturers given legal immunity by the government  no one else has legal immunity  not big oil not big coal not teachers unions police no one  yet vaccine manufacturers cannot be sued,pro-vaccine,,,yes,
whats with the clock just changing times kinda at random like its at 208 smith and next scene its 944 and then a few seconds later its 407,,,,,
they didnt find knowledgeable antivacxers for a reason  there are plenty of doctors that knew the dangers if vaccines put them on,skeptic,,,,
wow that lady is crazy the lady in the green dress oh wow,,,,,yes
van costs lives brings the disease to the population van gives opportunity to develop and spread disease that has never been a threat,,,,,
the docs arguments are weak most of these people have incomparably better ones,,,,,
ever heard of correlation vs causation the rise of internet has also been correlated with the prevalence of disease,,,,,
thats how a debate work literary is a part of the rules of a healthy debate there are laws and everything,,,yes,,
 patoastral2118  1 against 20 is not a debate the format allows for a more fluid exchange like that of alex oconnor and the one with jordan peterson,,,yes,,
being skeptical is definitely important  questioning information and investigating thoroughly is how we learn and grow but skepticism also means being open to credible evidence from all sides not just what fits a preconceived idea  doctor mike and many scientists actively review a wide range of research including dissenting views but they rely on data thats been rigorously tested and peerreviewer its not about ignoring other information but about distinguishing between credible evidence and misinformation  true skepticism involves critical thinking and evaluating the quality and source of information not just rejecting what challenges your beliefs without strong evidence its about being openminded but also discern,,negative,yes,,
its easy to bring up big names like face or claim someone hasn seen all the research but science isnt about a few individuals or isolated papersize about the full body of evidence built over time by thousands of researchers worldwide doctors like doctor mike rely on this extensive peerreviewer research not just a few cherrypicked studies  if someone claims to know the main doctors and research on the other side its important to check whether that research is credible has been peerreviewer and stands up to scrutiny many called other side claims have been debunked or lack solid scientific backing  science advances by questioning and testing but that also means accepting the consensus when the evidence overwhelmingly supports it its not about ignoring other views but about weighing the quality and reliability of all information,,neutral,yes,,
the last part is a question for a lawyer not a doctor,,,,,
 patoastral2118  i have asked lawyers  they say it allows for unchecked corruption plain and simple,,,,,
arent a threat due to the vaccine,skeptic,,,,
 patoastral2118  never a threat because they were from a different region species or lab,,,,,
i understand that it might seem like the doctors arguments are weak especially when emotions run high around this topic however the strength of an argument isnt just about how confidently its delivered or how persuasive it soundsits about the evidence behind it  doctors like him base their points on a vast amount of scientific research clinical trials and data collected over many years many of the counterarguments you hear from antivaccine groups often rely on personal stories misinformation or studies that have been debunked or taken out of context  its important to look beyond rhetoric and evaluate the credibility and quality of the evidence supporting each side thats how we get closer to the truth and make informed decisions,skeptic,,yes,,
they dont have better arguments they just are more excited and show more energy,,,,,
 patoastral2118  of course they are probably because they have better arguments ,,,,,
people should not be taking health advice from me rfk,,,,,
typical from many commenters white dr being defended while very diverse group of people are called names,,,,,
i think all of this is a result of social media and things people read online everyone is an expert now   i try to keep this thought in mind from an article i read about flying an airplane when youre flying in the dark or in a low visibility situation the only thing you can trust is your instrument panel your mind may be telling you something different but you have to learn how to put aside these thoughts and trust your instruments  were all flying in the dark through life essentially our only guide is that instrument panel which is science,,,,,
wow this dude really got destroyed he had no words especially in the beginning questions this really highlighted the fact that vaccines arent without certain agendas attached and work differently for different people,pro-vaccine,,,,
im a vaxxer but that dude at the 30 min mark was cooking  my take away  its possible to have two truths,skeptic,,,,
tom by far is the safest people out of this group,,,,,
bro you cant sue a vaccine manufacturer they literally have protection from fault granted by the government,skeptic,,,,
rfk upheld the myth that black people dont feel pain like other people to that black brother please look at who youre defending,,,,,yes
vaccines prevent getting an illness uh im pretty sure its the exact opposite at least in regards to flu and cold type vaccines,pro-vaccine,,,,
the guest should be given time to articulate a comprehensive answer not cut them off due to the participant at the desk being voted out at least give 35 minutes please change the format otherwise brilliant program,,,yes,,
these folks are something like wow  also spontaneous abortion you mean miscarriage,,,,,
the brain was discovered in 1102  people before,,,,,
this format was crap its almost like the makers of this shitshow wanted to the appease the anthrax looks,,,yes,,
